{
  "attestation": null,
  "body": {
    "algorithm": {
      "name": "node_revision_assembler",
      "version": "1.0.0"
    },
    "code_digest": "sha256:4237b60322f9621bed6652194795eda9012dcf61f7f5568a1c44e861747b12c9",
    "code_revision": "flockoff-runtime-0.1.0",
    "input_hashes": [
      "sha256:b7f97d6bb094bd8385027753d914930829332172312948e38f0e331d6411a986",
      "sha256:58cab78a72f7fae48b884c155eb3f52c12c48a3c18cd42f13ea963b8b15e34a1",
      "sha256:5804def7ab2a9c46c98ed4cfdc252d76ae7a399a4e169be301849610d1dfa56c",
      "sha256:30cda6eed1324a8bc5372dd570bf7643ce4b0121e293ce0487dd08816805af5e",
      "sha256:e099df87b9155900b38c5583e20d1d57f990576f25d798c40789fe3960958b27",
      "sha256:9cd6d8edd04e1d486f23d6dd96c0398976c7e9eee1feddfea8bb74d0dc48bb24",
      "sha256:0120652a7d3533942e3fce4cdd59d98db0c466fa8166d886dde87ba044d70a35",
      "sha256:dc1a389670c6503749b77b5fe63b6ad47dc1f11282bf29634d5a66fe9400e7cf",
      "sha256:c07364a68c23d774dcad41111c4582d6c5cec16e14f3d37310fd22733ac211aa",
      "sha256:271adbd787b91535000e300b3f9efd61824c6d1433e15d5284f10e7f77137335",
      "sha256:a50f0ebf42f1651772cb917fcac903d2d83257cae171ceeeb68eeb93f555e88b",
      "sha256:803ed348df39afea33933b6d42f193ec6d419d257b2e341815276dbd81d19a6c",
      "sha256:0c9b471776d3239c9aa3d303c864c6772e1ee5ef23befd00dff13ca4e8d4a243",
      "sha256:fc5c1ae7e27ac9192e7a1202c91ce1d4bf9d4080cc7cc91b2b22fab905e19d78",
      "sha256:b4ffbc5ba8876704daeaade3e8792fae877bac7f5a3b2579edeb1e62c039548d",
      "sha256:3152c9adec7c5a73afda09355ef1dcad0e82c2baf4449c097837d09264d096e0",
      "sha256:f9d8a3739cc2eb5afc2bed33383c2ec20cf7869be93ac7885b45676dc7c29f9e",
      "sha256:07df3835512408b4096f32a92a96c77075a11872ac596ad42a5c94ef21263853",
      "sha256:4a90d7bb1d9dadbfd152a8678df3d315be77dc7b65b8a8e7340309844884c8c7",
      "sha256:842f3f07e6aed0552beabd90a63730e5d60789695ceb62edd832473ef628d3e4",
      "sha256:850d748f14cdcca7ad8d5a69d0a370d614fccef93bd62ba0f496f07fa11b10fd",
      "sha256:5ffa22e95f64dcbe99eed11df4fefea3b3a2291881672a4e1f0af85e6937ef67",
      "sha256:af3dd3f8e01e951e3b10cef301d48b526eef45208640d5e6ccde67bf6011af93",
      "sha256:036ec9140e9af221fb2f7c58b8dbd3b8d4b0d306f5d219f4b5832b5292e3e7a8",
      "sha256:a31cee8c7b3b22b0f04867dd6c0a245f3c6c85e3d1638fcfc106db6306215f54",
      "sha256:18cb9d89ce9017e9bb35db916c8724f66beff0a683fe5bea4936bf196535f675",
      "sha256:5cb42ccd893410cc9559d994b2dbb46c06ebe457b39ec8c4c908df15426c8ef9",
      "sha256:c7e23eed66d22b5305476a580fc6d16d3df46336d8881a586ccd9f9ee2beeb58",
      "sha256:bea159d09333798d28c30f0666d625142e17faaeb4c20ce6c41711ce2df3f557",
      "sha256:dcf0262ac98bb542499c4f02d3d7e792b773e813fa803d797d55b19f9ba4e819",
      "sha256:c119212c4fdb5477f2479ad378ab33e7136999f559a2f8d9bd9de2a8f6c5e81b",
      "sha256:9882eaa91de0f513e3f81b12a6dde1fcaf6c1ef095dbe840406b5bc4179aa6ed",
      "sha256:2e1d9da4e931aa676d0834e8d753096d63b21ac54b568f06bba36a6f2ff3e348",
      "sha256:a05070121dd1c433e68f933425b7857e96c54d148284c722dbec5b5efcf5b9c9",
      "sha256:314ad774101bbc5db5f958e437cc26b85ee085b96ff2c1c018953b2e1e3ee90a",
      "sha256:aaa1baff33f52336b93022788988a24227cd4bce441f78f4ab27a02c41f525fb"
    ],
    "input_refs": [
      "assoc_62187e80e4d88f3b1dbf6a8a151135630f828622",
      "assoc_84b9a9a5e3645370d9b44f98cf38b8a25644713c",
      "assoc_a8910510e7e8e2b7db15e1f67e31c70f32ad7ee3",
      "assoc_ae845206efd74d07f142518eaad5cf00b5fb479f",
      "assoc_af29a083a75afb56199292deecef65c5580fc16f",
      "assoc_d010e2063d2aa8a0383aa6a120328c17eacda13b",
      "assoc_d354cd99df50c8fa0d7684399a9f221358374e74",
      "assoc_f5e0ce16c7decfc9703ddc56ea29873db2072d39",
      "match_1fe9c58ca48db155c5db97531ff7b18c12b407d6",
      "match_2d44a6e0361cd7d72bf66c522f6c8b414be9ee2f",
      "match_59e0fde69738b30d4ab8d32e09bcb96f325b88bf",
      "match_6882c233d9a6a23bc1856b97e11f4338e453f300",
      "match_9c12f0150e6accb153d8e55824dec4a8a4274936",
      "match_a6a17036dfb264a97123a370ba85dda9b04a5433",
      "match_b8dd0d7eec84cc06c251112707490b004e4487b5",
      "match_cdbe4ce160fb5aa8fce34909ab7c426218ed9ef9",
      "mlineage_7c6dc8e5a4646eba18c392cf793261b6b3df6ac6",
      "mlineage_f48a9dd3b8ab856d3378936545f638fe0e56f341",
      "obs_1f8705164f5cb82180640989a686cba321065320",
      "obs_2828d225795e68e9eac28365433ab9e150e567f0",
      "obs_3223e31ef1d700dcce95db7118a8c71c18449aea",
      "obs_87bd9ac49dd0aabc58d206143408edf435c27d71",
      "obs_b4c63d3d758884701b2481c010e0aa377e42f6b6",
      "obs_d1ebafc67da3af44a2a72188020ae072e9d42c26",
      "obs_d3c141600973d68fe605ca29cb0cd4b1a659ab5a",
      "obs_d7ad2e15f8e35cca428f90d53ff46c8643ffeaeb",
      "partition_d15f83a056a4e6e9f74af26b9f0e0d0e45ea3755",
      "receipt_23da2c796b2bb9388c935d8264599a60cb9b4a36",
      "receipt_281891cb5bb271ba28157cc33d90bbe088a70172",
      "receipt_5db3a4fc13a1acb7a0f66c6f09fcf2330200d3df",
      "receipt_7cee270a0012bf7b4c04a9823055a15c19917875",
      "receipt_8b6ef18e78091b900b84351760e5ca1b8d0cf6b6",
      "receipt_b7cfc77080030a9cb9f8d9b673edc55a318e181e",
      "receipt_b89f221e4b51688aa580cf8fd9fba9fd8adc6ad6",
      "receipt_bde758bd9ddb422944c91e9cb202a552d188a77f",
      "receipt_c4cb1afca9cade65f81cbb14c255f9fd6cbd60ff"
    ],
    "output_hash": "sha256:571cd503a4a56fd607279bfae7be47fa9e4a752d12e272734f353a5e373c2b38",
    "parameters": {
      "calibration_required_for_probability": true,
      "claim_ceiling_policy": "candidate-rf-pattern-v1",
      "emitter_partition": "ephemeral_emitter_key",
      "motion_default": "MOTION_UNRESOLVED"
    },
    "parameters_hash": "sha256:843be08419cd431ebb7de6e7b49d2a80082fcac3bad83925291c243f25cb7c89",
    "receipt_version": "1.0.0",
    "source_locks": [
      {
        "content_hash": null,
        "revision": "7e969663eade07833603bad86cb156338e895583",
        "source_id": "https://github.com/colonelpanichacks/flock-you"
      }
    ],
    "subject_ref": "node_ed18ea3e03a6f47efdf320bad0eca12c:revision:1"
  },
  "receipt_hash": "sha256:5ec08fe1f38d09ef9197e2bb28f9bdfb40ebe82a73e124c73148bd4e46915faa",
  "receipt_id": "receipt_5ec08fe1f38d09ef9197e2bb28f9bdfb40ebe82a",
  "schema_version": "1.0.0"
}
