{
  "attestation": null,
  "body": {
    "algorithm": {
      "name": "node_revision_assembler",
      "version": "1.0.0"
    },
    "code_digest": "sha256:e38b95bc669b9980935ef794402657a950b6c84c6153d90fb2ce961043144b9a",
    "code_revision": "flockoff-runtime-0.1.0",
    "input_hashes": [
      "sha256:e35da9005e347a5236a1aa2f7383c54d42fd42de00e12d8ee92acfeff0e38df3",
      "sha256:3a082f2c48fa4334cdb986a6f26ef1f4c592bf1673a6692ed9366fe3f026df4d",
      "sha256:39961628178f84a71eefbc0836a4c1cd98af4969a02f28d2d4e5f05fc1d5da87",
      "sha256:315e79a08e5f6710e5c4843a3694db313d9b4f07577d95d67c189864aefb74df",
      "sha256:c133d50139bcaa4e9dc06d32c37ba0ed72ebcd25c223b267631cc62828be84c7",
      "sha256:d10d7437f00fbe7f757f579524309590ee94d16794b4e32a77914b62692280b6",
      "sha256:37ed6070c2a587aae38218d12421d2755cb1c2b3ae73d96c4c56f2b4932aee9b",
      "sha256:ace5c2f8de3be132911a3b49150988ae72b29e687c6de71dcf0edddd5f732853",
      "sha256:cb91a37231b3436c2376da7721080aa646a5ac63f0ce26b953842b872d47c657",
      "sha256:ed67fb7feb799033382e709ed2d8560a704fc7c17f6f96cc751c60742c30a239",
      "sha256:8b805901aefab5d1e4a064f2356b4aaca734f328a4cee37accb19c95d1aa89eb",
      "sha256:ea7bf3e55b88d45eeac89fd25782f8013374189ba5a3468677e18fbe3b1a983b",
      "sha256:c29c7466f34c7f4f074c021d07039103b68d9ea6c83f4f87bb9d6856f41e9e3a",
      "sha256:61c8c0dc5f7c18e988a07ee7f8c376eefde1d0fe5dfd4079b86db43ef9f991f8",
      "sha256:1aa2c21d90c253ece637f88d18ad61e59723957cb9b0d929c6f20d1b8e5bab05",
      "sha256:399690e9a3f3205544a307bd9f136297e9ee39dbffba4a0f795d967e9e3233a0",
      "sha256:7adb554067d59fd29c4143a3f64a752ed0633d13cac1de4ebc7c0f8b307eec0b",
      "sha256:bc056afc29864d74fb6c178da9ec8f79e3e6a4dd2cdbc485fd45650b2cd9e691",
      "sha256:4a90d7bb1d9dadbfd152a8678df3d315be77dc7b65b8a8e7340309844884c8c7",
      "sha256:842f3f07e6aed0552beabd90a63730e5d60789695ceb62edd832473ef628d3e4",
      "sha256:850d748f14cdcca7ad8d5a69d0a370d614fccef93bd62ba0f496f07fa11b10fd",
      "sha256:5ffa22e95f64dcbe99eed11df4fefea3b3a2291881672a4e1f0af85e6937ef67",
      "sha256:af3dd3f8e01e951e3b10cef301d48b526eef45208640d5e6ccde67bf6011af93",
      "sha256:036ec9140e9af221fb2f7c58b8dbd3b8d4b0d306f5d219f4b5832b5292e3e7a8",
      "sha256:a31cee8c7b3b22b0f04867dd6c0a245f3c6c85e3d1638fcfc106db6306215f54",
      "sha256:18cb9d89ce9017e9bb35db916c8724f66beff0a683fe5bea4936bf196535f675",
      "sha256:73f7ae3ae26c3ecb9ea204d404a04fc0784619032f443cedf047e026d4a8ac83",
      "sha256:359d234469609e1c0df5b233a42c9a1c64881fd8ce2d90e9edd4300879bb9b29",
      "sha256:d16c532347c7108fb54d99025f4fc284dca5a71340fa5d2f002d7e594ef8aa5d",
      "sha256:2112456d536d3bfed58bc03c3cc68d8790f7898db824c1472f3d2dbbe8bc8fb5",
      "sha256:78d84f6146d6938eaaa8fde9b13ccd03d6c50ae5f478ef5038150db40df07dab",
      "sha256:5033aab20110d29c6ece31a32ebaf5f9a40a18fc63dcbbee992bca45281646ca",
      "sha256:362d579575b05e76ad73c5a4ce088420a761358dce9c36bad03c6f5b1f864e46",
      "sha256:40030f3808521d54e5b396529ca4815f3a8c4eb5ebf260afbaeae7c536b163c4",
      "sha256:63cba9aa122837c2fc1ed98c57dc15fdb0f71a56066b3a1642fd8b06599a3bb8",
      "sha256:7696fba2eb6be26b6e3a58c484bb110d9076e1c23f8d1ad8e52d6ec1b616bd67"
    ],
    "input_refs": [
      "assoc_62187e80e4d88f3b1dbf6a8a151135630f828622",
      "assoc_84b9a9a5e3645370d9b44f98cf38b8a25644713c",
      "assoc_a8910510e7e8e2b7db15e1f67e31c70f32ad7ee3",
      "assoc_ae845206efd74d07f142518eaad5cf00b5fb479f",
      "assoc_af29a083a75afb56199292deecef65c5580fc16f",
      "assoc_d010e2063d2aa8a0383aa6a120328c17eacda13b",
      "assoc_d354cd99df50c8fa0d7684399a9f221358374e74",
      "assoc_f5e0ce16c7decfc9703ddc56ea29873db2072d39",
      "match_11be58f16cc4a08b3e660aa7f9247c6fda948451",
      "match_176cbabad39be9f440883258dfd4bd1ffb719581",
      "match_2a551b7fdf4ac400bf54ed29d0f62d3d0296ee14",
      "match_6d3a74c8b71ef1044ccdc4adbcefa3019422c2f7",
      "match_996ef7c1bda3712c581ce4d28cf8c132f6bbde8c",
      "match_a57663eb04cb611695f9795c11ff4f0d0585bd4a",
      "match_e05c449f256bfb1ca45c4fecc87c17e81ef16a7a",
      "match_e5bf9331bb662e1c97af09fee467178ce5f85e80",
      "mlineage_7c6dc8e5a4646eba18c392cf793261b6b3df6ac6",
      "mlineage_f48a9dd3b8ab856d3378936545f638fe0e56f341",
      "obs_1f8705164f5cb82180640989a686cba321065320",
      "obs_2828d225795e68e9eac28365433ab9e150e567f0",
      "obs_3223e31ef1d700dcce95db7118a8c71c18449aea",
      "obs_87bd9ac49dd0aabc58d206143408edf435c27d71",
      "obs_b4c63d3d758884701b2481c010e0aa377e42f6b6",
      "obs_d1ebafc67da3af44a2a72188020ae072e9d42c26",
      "obs_d3c141600973d68fe605ca29cb0cd4b1a659ab5a",
      "obs_d7ad2e15f8e35cca428f90d53ff46c8643ffeaeb",
      "partition_77aff0ac16b2a5eec351096669312f97778bcf56",
      "receipt_080e6124b20df77c48e56d812c3986a4f33a7419",
      "receipt_140466611aab9e2db7e9dfd0886fc3c62b3b3d5f",
      "receipt_5af266bc40f1fe46093c36375aaa9bde4339c38d",
      "receipt_63cd4466fb0a804e687633789345bdac7a9766d9",
      "receipt_9561a318a84eabd804d84ba76fe54eb8db0ba13b",
      "receipt_b1105edc91689f52729501697f31675ca63ef95d",
      "receipt_c744f297a5fa122cac14d806db09dd966f88857b",
      "receipt_d9f103b1d3ec921ac7aab522d6e88b18f7d2e7f4",
      "receipt_e28f97036fa721be2ae7b1738c9b7610e34e593e"
    ],
    "output_hash": "sha256:a1fc1c62b15be04d6a2d31329ff4c8f0607012e9279fbdd35c1461570bf2d95b",
    "parameters": {
      "calibration_required_for_probability": true,
      "claim_ceiling_policy": "candidate-rf-pattern-v1",
      "emitter_partition": "ephemeral_emitter_key",
      "motion_default": "MOTION_UNRESOLVED"
    },
    "parameters_hash": "sha256:843be08419cd431ebb7de6e7b49d2a80082fcac3bad83925291c243f25cb7c89",
    "receipt_version": "1.0.0",
    "source_locks": [
      {
        "content_hash": null,
        "revision": "7e969663eade07833603bad86cb156338e895583",
        "source_id": "https://github.com/colonelpanichacks/flock-you"
      }
    ],
    "subject_ref": "node_ed18ea3e03a6f47efdf320bad0eca12c:revision:1"
  },
  "receipt_hash": "sha256:b4b3b1cc917bf2007395ad285e20ab993c640b5af4709fe5d0c9862228e1e2ca",
  "receipt_id": "receipt_b4b3b1cc917bf2007395ad285e20ab993c640b5a",
  "schema_version": "1.0.0"
}
